{
  "$schema": "https://json-schema.org/draft/2020-12/schema",
  "$id": "https://flextudio.local/meta-contract/v1/scenario.schema.json",
  "title": "Scenario",
  "description": "flextudio scenarioMeta 루트. modules/htmlkey/ScenarioTitle/fConverterVersion/Collections 는 고정값 강제.",
  "$comment": "Compatible flextudio engine: 6.4.x (verified against 6.4 series scenario samples and public/engine source). Engine major bump (6→7) requires new contract version (v2).",
  "x-engineCompat": {
    "minEngine": "6.4.0",
    "testedAgainst": "6.4.x",
    "verifiedSamples": "flextudio-ai-studio/scenario_sample*/*.json (45 files)",
    "lastVerified": "2026-05-04"
  },
  "type": "object",
  "required": ["Steps"],
  "additionalProperties": true,
  "properties": {

    "modules": {
      "description": "런타임 모듈 슬롯. 항상 빈 객체 고정.",
      "const": {}
    },

    "htmlkey": {
      "description": "고정값 'stephtml'.",
      "const": "stephtml"
    },

    "ScenarioTitle": {
      "description": "가비지 슬롯. 항상 빈 문자열 '' 고정 (실제 표시명은 fScenarioName 사용).",
      "const": ""
    },

    "fScenarioName": {
      "type": "string",
      "description": "시나리오 표시명."
    },

    "fConverterVersion": {
      "description": "메타 컨버터 버전. 1 고정.",
      "const": 1
    },

    "StartSteps": {
      "type": "array",
      "description": "진입 StepId 배열. Steps가 있으면 1개 이상 필수.",
      "items": { "type": "string", "pattern": "^Step[1-9][0-9]*$" }
    },

    "Steps": {
      "type": "object",
      "description": "Step 컨테이너. 키가 StepId, 값이 Step 객체.",
      "patternProperties": {
        "^Step[1-9][0-9]*$": { "$ref": "step.schema.json" }
      },
      "additionalProperties": false
    },

    "Language": {
      "type": "object",
      "description": "다국어 매핑 ({{key}} 치환 대상)."
    },

    "Events": {
      "$ref": "events.schema.json",
      "description": "시나리오 이벤트 핸들러 맵. 키=핸들러 이름, 값=Action 배열(Script/LinkedEvent/Service/API). 스킬 생성 시 Service/API 액션 금지 — [no-service] strict."
    },

    "ServiceBinding": {
      "$ref": "service-binding.schema.json",
      "description": "서비스 바인딩 맵. 스킬 생성 시 비어있는 객체 {} 만 허용 — [no-service] strict (`strict_no_service:true`). 운영 메타 호환을 위해 형식 정의."
    },

    "Collections": {
      "description": "런타임 채움 슬롯. AI 생성 모드에서는 **빈 객체 const 고정** — 스튜디오가 컬렉션키 type 정의를 자동 재생성하므로 AI 는 채우지 않는다. Panel.{Category, CategoryOrder, Collection.Ckeys} 도 동일 정책.",
      "const": {}
    },

    "DataSources": {
      "$ref": "data-sources.schema.json",
      "description": "명명 DataSource 모음. Combo/RadioBox/Search/Tree/MultiCheckBox/Approval/TimeTable/Scheduler 의 DataSourceName 참조 대상."
    },

    "__notes": {
      "type": "array",
      "description": "비대화형 생성(`flex-scenario gen`) 호출 시 모델이 자기-인터뷰 5질문에 답한 결정 가정. 사용자가 결과 JSON 만 보고도 '어떤 가정으로 만들어졌는가' 를 파악해 redirect 할 수 있게 5~7줄 권장. UI 에 표시되지 않으며 strict-fields 통과용 화이트리스트 슬롯. 진실원본: skill-guides/prompt-interview.md",
      "items": { "type": "string", "minLength": 1 },
      "maxItems": 12
    },

    "Scenario": {
      "type": "object",
      "description": "시나리오 옵션. StyleURLs 배열에 외부 JS 라이브러리(Chart.js, 지도 SDK 등) 경로 추가.",
      "additionalProperties": false,
      "properties": {
        "StyleURLs": {
          "type": "array",
          "description": "외부 라이브러리 JS 경로 배열. 차트/지도/외부 SDK 등 사용 시 여기에 URL 추가.",
          "items": { "type": "string" }
        }
      }
    },

    "Panel": {
      "type": "object",
      "description": "데이터 모델 슬롯. 키 6개 고정 — AI 생성 시 별도 키 추가 금지. 각 슬롯의 내부 값(Ckeys 배열, Category 객체 등)은 운영 메타에서 채워짐.",
      "additionalProperties": false,
      "properties": {
        "Collection": {
          "type": "object",
          "description": "전역 컬렉션. AI 생성 시 { Ckeys: [] } 빈 형태. 운영 메타에서 채울 때는 `_SUID` 시스템 키 + 모든 카테고리 Ckey 합집합. 시스템 게터 (`status`/`isActive`/`length` 등) / JS 빌트인 충돌 키는 schema 차단 (단 `_SUID` 는 시스템 등록 키이므로 예외).",
          "properties": {
            "Ckeys": { "$ref": "naming-objects.schema.json#/$defs/ckeysArrayWithSuid" }
          }
        },
        "Category":      {
          "type": "object",
          "description": "카테고리 정의. AI 생성 시 빈 객체. 운영 메타에서 채울 때 키(카테고리명) 는 JS 식별자 규칙 + JS 빌트인 충돌 차단 (naming-objects.categoryName).",
          "propertyNames": { "$ref": "naming-objects.schema.json#/$defs/categoryName" }
        },
        "CategoryOrder": {
          "type": "array",
          "description": "카테고리 순서. AI 생성 시 빈 배열. Category 키 집합과 정확히 일치해야 함 (validator).",
          "items": { "$ref": "naming-objects.schema.json#/$defs/categoryName" }
        },
        "Table":         { "type": "array",  "description": "AI 생성 시 빈 배열." },
        "ExternalTable": { "type": "array",  "description": "AI 생성 시 빈 배열." },
        "AuthKey":       { "type": "array", "maxItems": 0, "description": "★ AI 생성 시 반드시 빈 배열 `[]` — 권한키는 사용자 수동 설정 전용 (schema 레벨 maxItems:0 로 차단)." }
      }
    },

    "LastSavedTime": {
      "type": "number",
      "description": "마지막 저장 시각 (Unix timestamp, milliseconds). 스튜디오 저장 시 자동 기록 — 실 시나리오 42/45 에 존재. AI 생성 시 누락/0 허용."
    },

    "FlexSQLService": {
      "description": "FlexSQL 서비스 이름/버전 매핑 슬롯(getFlexSQLServiceList). 운영 메타에서는 {NameArray, VersionMap} 으로 채워질 수 있으나, AI 생성 시 빈 객체 고정.",
      "const": {}
    },

    "EmbedScenarioPrefix": false
  },

  "allOf": [
    {
      "$comment": "Steps 가 1개 이상이면 StartSteps 도 1개 이상 필수.",
      "if": {
        "required": ["Steps"],
        "properties": {
          "Steps": { "type": "object", "minProperties": 1 }
        }
      },
      "then": {
        "required": ["StartSteps"],
        "properties": {
          "StartSteps": { "type": "array", "minItems": 1 }
        }
      }
    }
  ]
}
