{
  "modules": {},
  "htmlkey": "stephtml",
  "ScenarioTitle": "",
  "fConverterVersion": 1,
  "fScenarioName": "리스트→상세→입력 (3-step)",
  "Collections": {},
  "FlexSQLService": {},
  "ServiceBinding": {},
  "StartSteps": [
    "Step1"
  ],
  "Language": {},
  "Events": {},
  "Panel": {
    "Collection": {
      "Ckeys": []
    },
    "Category": {},
    "CategoryOrder": [],
    "Table": [],
    "ExternalTable": [],
    "AuthKey": []
  },
  "Steps": {
    "Step1": {
      "StepName": "[스텝명]",
      "StepType": "StepView",
      "UseBackButton": false,
      "UseBottomButton": false,
      "UseEvents": false,
      "Events": [],
      "Next": [
        "Step2"
      ],
      "Padding": {
        "Right": "0",
        "Btm": "0",
        "UseAuto": true,
        "Left": "0",
        "Top": "0",
        "All": "",
        "UseEach": true,
        "SizeUnit": "px"
      },
      "BgStyle": {
        "UseBackground": true,
        "BgColor": "var(--colorGray9)"
      },
      "Contents": [
        {
          "Id": "f_1001",
          "ContentsName": "HeaderWrap",
          "ContentsType": "Group",
          "ContentStyle": "None",
          "UseDataConnection": false,
          "design": {
            "w": "full",
            "h": "text",
            "bg": "card",
            "p": "20 20 16 20"
          },
          "Contents": [
            {
              "Id": "f_1002",
              "ControlType": "Label",
              "ControlName": "lblPageTitle",
              "labeltext": "[제목]",
              "ControlStyle": "None",
              "Caption": "Label1",
              "isColumnCtrl": false,
              "design": {
                "font": "display-medium",
                "color": "body",
                "w": "full",
                "h": "text"
              }
            }
          ]
        },
        {
          "Id": "f_1010",
          "ContentsName": "FilterWrap",
          "ContentsType": "Group",
          "ContentStyle": "None",
          "UseDataConnection": false,
          "design": {
            "w": "full",
            "h": "text",
            "bg": "card",
            "p": "12 20 16 20",
            "flex": {
              "dir": "column",
              "gap": 12
            }
          },
          "Contents": [
            {
              "ContentsType": "Group",
              "ContentsName": "InputAction",
              "ContentStyle": "None",
              "UseDataConnection": false,
              "Id": "f_3105",
              "design": {
                "w": "full"
              },
              "Contents": [
                {
                  "ControlType": "InputText",
                  "ControlDefaultName": "InputText",
                  "ControlName": "FieldText",
                  "ControlName2": "FieldText",
                  "ControlStyle": "None",
                  "Caption": "",
                  "isColumnCtrl": false,
                  "UseEvents": false,
                  "DisplayType": "CtrlDisplayCkey",
                  "InputType": "text",
                  "Id": "f_3102",
                  "Placeholder": "[입력 안내]",
                  "design": {
                    "w": "full",
                    "h": "48px",
                    "font": "body-medium",
                    "border": "hairline-strong",
                    "radius": "8",
                    "caption": {
                      "font": "body-small",
                      "align": "start"
                    }
                  }
                },
                {
                  "ContentsType": "Group",
                  "ContentsName": "TrailingAction",
                  "ContentStyle": "None",
                  "UseDataConnection": false,
                  "Id": "f_3104",
                  "design": {
                    "w": "44px",
                    "h": "45px",
                    "bg": "card",
                    "flex": {
                      "dir": "row",
                      "align": "center",
                      "valign": "center"
                    },
                    "abs": {
                      "t": 1,
                      "r": 1
                    }
                  },
                  "Contents": [
                    {
                      "ControlType": "Label",
                      "ControlDefaultName": "Label",
                      "ControlName": "IconButton",
                      "ControlName2": "IconButton",
                      "ControlStyle": "styleLineNone",
                      "Caption": "",
                      "isColumnCtrl": false,
                      "LabelType": "labeltext",
                      "labeltext": "",
                      "Id": "f_3103",
                      "UseClickEvent": false,
                      "design": {
                        "w": "28px",
                        "h": "28px"
                      },
                      "ImageStyle": {
                        "IsLineIcon": true,
                        "Img": "B_000_001",
                        "UseImage": true,
                        "ImageSize": "24",
                        "ImageColor": "var(--colorGray2)"
                      }
                    }
                  ]
                }
              ]
            },
            {
              "ControlType": "RadioBox",
              "ControlDefaultName": "RadioBox",
              "ControlName": "SegmentedRadio",
              "ControlName2": "SegmentedRadio",
              "ControlStyle": "stylePeriod",
              "Caption": "",
              "isColumnCtrl": false,
              "Items": [
                {
                  "ItemName": "[옵션 1]",
                  "ItemValue": "[옵션 1]"
                },
                {
                  "ItemName": "[옵션 2]",
                  "ItemValue": "[옵션 2]"
                },
                {
                  "ItemName": "[옵션 3]",
                  "ItemValue": "[옵션 3]"
                },
                {
                  "ItemName": "[옵션 4]",
                  "ItemValue": "[옵션 4]"
                }
              ],
              "Id": "f_3106",
              "UseItemDesign": true,
              "ItemDesign": {
                "FontStyle": {
                  "UseFont": true,
                  "FontAlign": "center"
                },
                "BgStyle": {}
              },
              "design": {
                "w": "full",
                "h": "35px",
                "itemBg": "ink"
              }
            }
          ]
        },
        {
          "Id": "f_1020",
          "ContentsName": "ListWrap",
          "ContentsType": "Group",
          "ContentStyle": "None",
          "UseDataConnection": false,
          "ScrollType": "ScrollY",
          "design": {
            "w": "full",
            "h": "text",
            "p": "16 20 20 20",
            "flex": {
              "dir": "column",
              "gap": 12
            }
          },
          "Contents": [
            {
              "Id": "f_1030",
              "ContentsName": "Card1",
              "ContentsType": "Group",
              "ContentStyle": "None",
              "UseDataConnection": false,
              "UseMove": true,
              "MoveSteps": {
                "MoveStepOrder": [
                  "Step2"
                ],
                "Step2": {
                  "Condition": "",
                  "MoveTo": "Next"
                }
              },
              "design": {
                "w": "full",
                "h": "text",
                "bg": "card",
                "p": "16",
                "elevation": "radius-shadow",
                "flex": {
                  "dir": "column",
                  "gap": 8
                }
              },
              "Contents": [
                {
                  "Id": "f_1031",
                  "ContentsName": "Row1",
                  "ContentsType": "Group",
                  "ContentStyle": "None",
                  "UseDataConnection": false,
                  "design": {
                    "w": "full",
                    "h": "text",
                    "flex": {
                      "dir": "row",
                      "align": "between",
                      "valign": "center"
                    }
                  },
                  "Contents": [
                    {
                      "Id": "f_1032",
                      "ControlType": "Label",
                      "ControlName": "lblWONo1",
                      "labeltext": "[제목]",
                      "ControlStyle": "None",
                      "Caption": "Label1",
                      "isColumnCtrl": false,
                      "design": {
                        "font": "title-medium",
                        "color": "body",
                        "w": "text",
                        "h": "text",
                        "fixed": true
                      }
                    },
                    {
                      "ControlType": "Label",
                      "ControlDefaultName": "Label",
                      "ControlName": "Badge",
                      "ControlName2": "Badge",
                      "ControlStyle": "None",
                      "Caption": "",
                      "isColumnCtrl": false,
                      "LabelType": "labeltext",
                      "labeltext": "[상태]",
                      "Id": "f_3107",
                      "design": {
                        "font": "body-small",
                        "color": "preview",
                        "bg": "subtle",
                        "radius": "9999",
                        "p": "4 8",
                        "w": "text",
                        "h": "text"
                      }
                    }
                  ]
                },
                {
                  "Id": "f_1033",
                  "ControlType": "Label",
                  "ControlName": "lblItemProcess1",
                  "labeltext": "[텍스트]",